原因,関係,結果
購入したくない気持ちになりますが、,逆接,しっかりとした説明や成分等、また、どの様な効果があるのかを今後も購入してみようと思います
いかに詳しくわかりやすく説明して下さる方で知識が豊富なので,原因・理由,しっかりとした説明や成分等、また、どの様な効果があるのかを今後も購入してみようと思います
今回で3回目の髪質改善ですが,逆接,とても大満足です
緊張してお店に入りましたが、,逆接,スタッフの方がその緊張を和らいでくださりました
ほぼシャンプー台で寝ているだけなのに、,逆接,帰り仕上がりは、今までの自分ではない、ツヤツヤの仕上がりの自分の髪に満足しました
人それぞれ価値観は違いますが、,逆接,絶対に気分は上がるはずです
ことがわかったため、,原因・理由,私は次回はここで縮毛矯正をお願いしようと思います
めちゃくちゃ良かったです他の髪質改善サロンに行ったことがないので,原因・理由,効果や値段の比較は出来ませんが
効果や値段の比較は出来ませんが,逆接,カット直後から指通りが違いました
のが少し悩みでしたが、,逆接,私の髪は絡まること無かったです
感動しましたただ乾かす時少し生乾きみたいな (カラー剤の匂いか髪質改善の薬剤の匂いなのかな…?)持続期間は人それぞれ髪質によっても変わるそうですが、,逆接,私は行きます
とても疲れていたので、,原因・理由,気持ち良く帰って来ました
ありがとうございます前回かなりカットもしたので、,原因・理由,いつもより仕上がりが良かったです
好みも似合う色もわかってくれてるので,原因・理由,信頼してる美容師さんです
久しぶりに明るくしましたが,逆接,違和感なくいい仕上がりでした
忙しそうですが、,逆接,サロン内は終始楽しくお話しして過ごせました
丁寧に接客してくれるので,原因・理由,サロン内は終始楽しくお話しして過ごせました
急病も予約忘れも仕方ないことですが、,逆接,適当に取られたりするのは悲しいです
いつも満足していて今回も仕上がりをとても楽しみにしていたので,原因・理由,残念でした
トリートメントとカットのみだったんですが、,逆接,とても丁寧な施術で満足です
髪の毛が嘘のようにツヤッツヤで人生で1番感動しましたですが,逆接,元通りとまでは行きませんが
元通りとまでは行きませんが,逆接,やっぱり通うのは必須だと思いました
のがかなり分かりましたので,原因・理由,やっぱり通うのは必須だと思いました
今回で2回目の髪質改善なのですが,逆接,今回もツルツルのサラサラでとても大満足です
必ずいきますので,原因・理由,よろしくお願いします
いつもお世話になっております毎回髪の毛がサラサラになるので,原因・理由,行くのが楽しみです
色落ちしてるはずなのに,逆接,のは3ヶ月前のブリーチ毛で綺麗な髪色をしていると
感じていましたが,逆接,毛量が大変と思う
勿論自宅ドライヤー後多少うねりはありますが、,逆接,嬉しいです
親切で理想の仕上がりでしたトリートメントを満足いったことがなかったのですが、,逆接,すごい是非これからもお願いしたいです
今でも継続されてるので,原因・理由,すごい是非これからもお願いしたいです
カットはブリーチ毛と伸びてきてたそうでない髪で最後髪質改善も初めてだったけど、,逆接,匂いが続きました
感じましたが、,逆接,丁寧で納得できるカウンセリングだったのと
希望時間内に終わるようにしてくれたので,原因・理由,良かったです
毛先の絡まりがひどかったですが、,逆接,そちらも改善されました
縮毛矯正後のカラーだったので、,原因・理由,ある程度の痛みは予想していましたが、
ある程度の痛みは予想していましたが、,逆接,カラーとケラチンファンデレベル5で行いました
現状があまり傷んでないから,原因・理由,美容師さんからも大丈夫とのことで
結果その当日はアイロン仕上げでも絡まるな、、くらいでしたが、,逆接,髪のてっぺんあたりがチリチリになっており
?)ケラチンファンデがどのようなものが分からないので、,原因・理由,なんとも言えませんが、、
なんとも言えませんが、、,逆接,(当日はトリートメントらしき施術は数秒でした
感じだったので、,原因・理由,また、トリートメントの効果が感じられませんでした
美容師さんは言葉を多く言っていたので,原因・理由,尚更がっかり感が強かったです
初めてトリートメントのレベルを落としたのですが、,逆接,見た目も手触りもお願いしたいと思える
髪質改善以前から気になっていたんですが、,逆接,大満足ですまた行きたいと思います
他の美容室でも髪質改善したことはあったので,原因・理由,仕上がりはあんな感じになるかなと思っていましたが、
仕上がりはあんな感じになるかなと思っていましたが、,逆接,全然違いました想像以上でした是非またお願いしたいです
ケラチンファンデは札幌一だと思っておりましたが、,逆接,今回は残念なポイントがいくつか御座いました
こちらの店舗は素晴らしいと思っておりましたが,逆接,今回はケラチンファンデの施術にてシャンプーでの髪の毛の扱いがとても雑でした
レベル6の施術を行いましたが,逆接,今回は初めて、仕上がりがガサガサでした
とても人気な店舗ですので,原因・理由,お忙しい中での接客は大変だと思いますが、
お忙しい中での接客は大変だと思いますが、,逆接,美容系の店舗は技術はもちろんのこと、それ以上に人で選ばれるのではないかと
今の髪の事や、本来の髪の事、施術の事などしっかり説明していただけたので,原因・理由,安心してお願いできました
ストレートアイロンを使用した為,原因・理由,仕上げの工程で乾かしたのみだとどのくらいの仕上がりになるか
以前は一生懸命ヘアアイロンで真っ直ぐ伸ばしていましたが,逆接,今は綺麗な髪を維持できています
ことも親切に教えてくれるので,原因・理由,安心して通えています
言われたのですが,逆接,良かったです
満足しています毎日髪の毛を巻いていますが、,逆接,巻き髪でもサラサラで手触りが良く、
髪の毛を伸ばしたかったのですが、,逆接,切らなければ改善することはないと
半分程ブリーチ毛があったので,原因・理由,切らなければ改善することはないと
伸ばせるので,原因・理由,頑張って伸ばしましょうと
私は関して疎いので,原因・理由,全然きづかなかったのですが、
全然きづかなかったのですが、,逆接,長さあまり変えずと
髪の長さが左右も前後ろも長さがバラッバラでした…伸ばしてるので,原因・理由,長さあまり変えずと
伝えていたのに、,逆接,ただ、しかも左右もバラバラの長さでとてもショックでした
のばしていたのに,逆接,前と後ろでガッツリ段差が出来ていて、
9月は旅行も娘の七五三の撮影もあるので,原因・理由,のに本当に残念です
満足でしたので,原因・理由,カラーだけは残念です
サラサラになりましたが、,逆接,少し頭皮がかゆいです
初めて行ったので,原因・理由,緊張していましたが、
緊張していましたが、,逆接,安心して受けることが出来ました
丁寧に説明して下さったので、,原因・理由,安心して受けることが出来ました
1週間経ちましたが、,逆接,お願いします
2回目ですが,逆接,居心地が素敵に仕上げて下さるだろうと
確信したので,原因・理由,今回、あえて指名はしませんでしたが
今回、あえて指名はしませんでしたが,逆接,とてもありがたいです
方で大変満足です髪の毛を良くする為のご説明も都度しっかりして下さるので,原因・理由,とてもありがたいです
今回はホームケアのトリートメントも購入してみたので、,原因・理由,自宅でのケアも頑張ろうと思いました
スタッフさんばかりが揃っているので,原因・理由,こちらのモチベーションも上がりますし
トリートメントから2週間以上経ちましたが,逆接,ドライ後の髪の艶感と柔らかさが全然違いますし、
今まで他の方を指名していたのですが,逆接,方を指名したのですが
方を指名したのですが,逆接,正直ガッカリしました
まず今回は縮毛をお願いしましたが、,逆接,絡まって切れ毛だらけになりました
聞いてましたが、,逆接,自分の触った感覚だと
理解して頂いたはずが、,逆接,前回は話を聞いてないんだなと思いました
そんな扱いかもしれませんが、,逆接,もう来なくて良い客で方が印象です
サロンだったので,原因・理由,行かせて頂きました
痛みが酷かったので,原因・理由,コースを選ばせて頂きました
名前が分からないのですが、,逆接,名前が分かれば
トリートメント後はツヤツヤになりましたが、,逆接,ハイダメージのところはまだまだ…と言ったところです
重々承知な為、,原因・理由,が美は成らずは34回定期的に通って髪の変化を実感して行きたいと思いました
ずっと美容室迷子だったので,原因・理由,感謝です
とにかく艶髪が欲しいと思っていたので,原因・理由,あまりにも理想すぎました
時間はかかりましたが、,逆接,嬉しいです
うねりも出てきたので,原因・理由,収まったら良いなあと
パサつきによる広がりも、縮毛矯正ではないので、,原因・理由,うねりは多少出ますが、
うねりは多少出ますが、,逆接,ほとんど気になりません
髪の質量が増したので,原因・理由,ほとんど気になりません
髪の毛が絡まりづらくなったので,原因・理由,嬉しくなります…
2度目のレベル6のトリートメントをしていただきましたが、,逆接,やっぱり手触りもツヤも最高…パサつき始めてた毛先も生き返りました
初回時、涙が結構出てしまったのですが,逆接,今回はアシスタントさんがドライヤーの際顔周りに風が行かないように乾かしてくれてとてもありがたかったです
まだ3度目の利用ですが,逆接,また、嬉しかったです
髪がパサついていましたが,逆接,サラサラになりました
髪だったので,原因・理由,結構やばいと思ったんですが
結構やばいと思ったんですが,逆接,まとまって綺麗になるし
何をやっても駄目だったので,原因・理由,初来店
せっかくなので,原因・理由,レベルMAXの髪質改善トリートメントをしてもらいました
初めて髪質改善トリートメントをしましたが、,逆接,施術中のお話も楽しかったです♪これからも定期的に通いたいなと思う
美容室の担当が辞めてしまったので,原因・理由,こちらに初めて伺いました
かなりの人気店のようでしたので,原因・理由,カラーとトリートメントのメニューにしました
伺ったのですが、,逆接,女性の方にも要望通り丁寧なシャンプーや、とても丁寧な聞き取りをしていただきました
物販のお話もいただきましたが,逆接,今回はお断りさせていただきました
ちょうど手持ちのサロンシャンプーのストックが届いたばかりでしたので,原因・理由,今回はお断りさせていただきました
全体が鏡でしたので,原因・理由,お店の雰囲気は実際よりも広く感じました
ひとつだけ香りで外に出ましたが,逆接,帰りは帰りました
歩いていると自分自身で少し香りに酔っぱらってしまうほどだったので、,原因・理由,帰りは帰りました
自分の毛質にも問題があるので,原因・理由,やはり縮毛がベストだと思います
カットの予定は今回は無かったのですが…急遽の対応にも関わらず、,逆接,ありがとうございました定期的に通わさせて頂きますアシスタントさんも覚えていて下さりありがとうございましたまた、宜しくお願い致します
久々の来店にも関わらず,逆接,ありがとうございました定期的に通わさせて頂きますアシスタントさんも覚えていて下さりありがとうございましたまた、宜しくお願い致します
相談させていただきましたが、,逆接,選んでいただいたカラーがとても気に入っています
今までは痛みがひどく大変でしたが、,逆接,今では伸ばしていてよかったと思えるほどです
友達も褒めてくれるので,原因・理由,丁寧に接客してくれて満足ですありがとうございます
ブリーチとパーマですごい傷んでいた髪の毛でしたが、,逆接,良かったです
サロンのトリートメントでは自分の思うような仕上がりにならなかったのですが,逆接,こちらのお店では、結果となりました
最初のネット予約の段階から、配慮が行き届いていると思っていましたが,逆接,のはあまり好きではないですが
のはあまり好きではないですが,逆接,髪の毛を改善する為の説明をわかりやすくしっかり説明して下さりました
何より効果をしっかりと出してくれたので,原因・理由,そこが1番満足です
それ以降は多少ゴワつきが戻ったものの、,逆接,雰囲気のお店でした
初めての髪質改善で行きましたが、,逆接,感動しました
予約時間よりもかなり早く着いてしまったけど,逆接,必ず行こうと思いました
髪のうねりに悩んでいたのですが、,逆接,親身に相談に乗ってくださいました
私の髪質はくせ毛で湿気で広がってしまうので、,原因・理由,同じようなお悩みの方は縮毛矯正のほうがいいいかもです
初めての来た美容室でしたが、,逆接,気がします
定期的にケアをしていきたいと思っていますので、,原因・理由,よろしくお願いします
初めての髪質改善でしたが、,逆接,感動しました
人見知りですが,逆接,ごめんなさい…笑また絶対行きたいと思います
初めての髪質改善だったのですが、,逆接,丁寧に説明していただき安心してお任せできました
夏でバッサリ切ることも考えましたが、,逆接,この施術をしてからは、ロングヘアを楽しみたいなと
初めての髪質改善でしたが、,逆接,切れ毛もありましたが、
切れ毛もありましたが、,逆接,また来店したいと思います
人間なので,原因・理由,とても緊張しましたが
とても緊張しましたが,逆接,お邪魔したいです
そろそろ1ヶ月経ちますが、,逆接,感じました
正直まだ行かなくてもいいくらい満足していましたが、,逆接,このくらいの頻度でトリートメントする
のが好ましいようなので,原因・理由,予約しました
前回の効果がまだ残っているので,原因・理由,髪質改善はLv4で、
なんとなくの雰囲気だけお伝えしたのですが、,逆接,色味は傷んでない元気そうな髪になりました
トリートメントもレベルを前回より落としたにも関わらず、,逆接,色味は傷んでない元気そうな髪になりました
特に毛先はブリーチ毛なのに,逆接,色味は傷んでない元気そうな髪になりました
カラーリング、トリートメントを施術してもらいましたが,逆接,結果大満足でした
穏やかでいい感じの担当スタイリストさんに今後もお任せするので,原因・理由,宜しくお願いします
時間はかかりますけど、,逆接,よかったです
髪の毛の広がりが抑えられたので,原因・理由,よかったです
手ぐしすら通らなかったのに、,逆接,感じです
札幌離れてしまうけど、,逆接,来れる時ぜひまたお願いしたいです
大満足ですカットも説明しながら進めてくれたので,原因・理由,安心して任せることが出来ました
今までサロンのトリートメントは何度かやりましたが,逆接,のは初めてです
髪質改善、色んなところに行きましたが,逆接,ダントツでここが一番です本当にもちがいいです
かなりのダメージ毛と髪色のムラだったのですが、,逆接,丁寧に説明していただき施術していただきました
髪色も当初の希望よりも暗くはなりましたが、,逆接,色味はちゃんと調整してくださり綺麗に仕上げていただき満足しております
矯正ですが、,逆接,良くて助かっています
毎回思うのですが、,逆接,方とその後の方、指名の方、実はアットホームなお店なんだと
感じますので、,原因・理由,私も通わせて頂きながらアップデートできるように頑張りたいと思います
ツヤのある綺麗な状態がキープできるので,原因・理由,嬉しいです
カラーもなんとなくのイメージでお伝えしてしまっていますが、,逆接,ありがとうございます
初めて利用しましたが,逆接,とてもサラサラになったし、
待ち時間はありましたが、,逆接,他のお客さんと離れた席が個人的には気楽で良かった
ロングなので,原因・理由,髪の絡まりや痛みにすごく悩んでいましたが、
髪の絡まりや痛みにすごく悩んでいましたが、,逆接,とても良い状態になりました
初めて髪質改善をしましたが,逆接,とても良かったです
子供の兼ね合いでタイミングが少しずれてしまうかもしれませんが,逆接,来月はよろしくお願い致します
初めての髪質改善、色々なサロンで髪質改善のメニューがあるので,原因・理由,こちらのサロンに決めましたが
こちらのサロンに決めましたが,逆接,何よりサラサラツヤツヤで手触りも良く最高です
トリートメントだけなのに、,逆接,何よりサラサラツヤツヤで手触りも良く最高です
待ち時間を覚悟して行きましたが,逆接,施術を始めてもらえました
涙が出てきましたが,逆接,染みなかったです
初めての髪質改善でしたが、,逆接,色々相談にのってくれました
めちゃくちゃ満足ですドライヤー後の髪の広がりも解消されたので、,原因・理由,本当にやって良かったです
カットカラー髪質改善をお願いしましたが、,逆接,私は時点で大満足でした
初めて伺ったのに,逆接,笑ってしまいました
3か月ぷりに来店したので,原因・理由,また、髪の毛が傷み切っていました
髪の状態が良くなかったので、,原因・理由,のも分かりますが、
のも分かりますが、,逆接,あまりいい仕上がりではありませんでした
3週間くらいもちましたが、,逆接,以前は感じがします
アシスタントの女性はすごく丁寧で不満はなかったのですが、,逆接,担当の男性の方がすごく苦手でした
最後、2時間暑い中施行していたので,原因・理由,そしてなぜかそこでまた説明を始める
汗だくでほぼ脱水を起こしかけていたのに,逆接,そしてなぜかそこでまた説明を始める
曰く、2週間でおちるから,原因・理由,マメに施術に来いとのこと
満足でしたが、,逆接,仕上がりは本当に嫌すぎて残念でした
2回目のケラチンファンデでしたが、,逆接,綺麗な髪にしていきたいです
初めてだったので,原因・理由,緊張していたのですが、
緊張していたのですが、,逆接,感じです
初めて髪質改善をしてみましたが、,逆接,一回だけでもとても満足のいく仕上がりでした
ツヤツヤな仕上がりになるので,原因・理由,店内空間も常に綺麗な
のにも関わらず,逆接,痛みを感じる
髪質改善系のトリートメント、前々から気になってはいたのですが、,逆接,かなりのダメージ毛でしたが、
かなりのダメージ毛でしたが、,逆接,施術後扱いやすくなりました
今回はケラチンファンデーションまでできなかったので,原因・理由,思います…またよろしくお願い致します
3週間ごとに髪質改善を受けるもより効果を実感できるらしいので,原因・理由,通って髪を蘇らせたいです
毛先は引っかかるようになってきましたが,逆接,サラサラです
初めて行ってみたのですが、,逆接,何日か経っても行きたいと思います
お値段相応の仕上がりですので、,原因・理由,施術後は幸せな気持ちで帰れます
いつも忙しそうですが、,逆接,いつでも親切丁寧に対応してくれますし、
お話が楽しいので,原因・理由,のがいつもワクワクしちゃいます
初めてだったので,原因・理由,不安でしたが
不安でしたが,逆接,満足ですありがとうございました
大雑把な要望を伝えてしまいましたが、,逆接,また、素敵に仕上げていただき満足でした
金額の提示に少し驚いてしまったため、,原因・理由,施術前にプラスの料金について説明をいただけたら良かったなと思いました
大満足ですGINGERさんはどのスタイリストさんも理想の髪にしてくださるので,原因・理由,いつも安心して任せられます
艶々の髪にしてもらえるので,原因・理由,のが楽しみです
ここの美容室で初めてブリーチをしましたが,逆接,よかったです
いつも綺麗に染まるので,原因・理由,嬉しいです理想通りの色になるので
嬉しいです理想通りの色になるので,原因・理由,髪質も良くなってきました
気分良くなるので,原因・理由,よろしくお願いします
白髪も気になっていましたが、,逆接,しっかり染まり大変満足して帰って来ました
広がりやすくてまとまらない髪が悩みでしたが、,逆接,凄くまとまるように仕上がりましためちゃめちゃ満足ですバイト代貯めて
すこーしだけ待ち時間はありましたが、,逆接,満足です、ありがとうございました
カラーはいい感じに明るくしていただいたので,原因・理由,色落ちが楽しみです
のが私は好きではないのですが、,逆接,居心地が良かったです
トリートメントの話とかはしっかりしてほしいタイプなので,原因・理由,居心地が良かったです
スタイルや物の良し悪しをハッキリと仰ってくださるので,原因・理由,迷うことなくお任せする事が出来ました
遠方のため、ことは致しかねてしまうのですが,逆接,定期的に札幌には伺わせて頂きたく存じます
お洒落なお店ですが,逆接,満足度の高いサロン=仕上がりの持続×スタッフの人柄と仰っているように、スタッフさん全員がリラックスできますし
2度目の来店でしたが、,逆接,1度目にしていただいた
今回はカラーとトリートメントしていただいたのですが、,逆接,感動の仕上がりで満足です友達や初めて会う人にも必ず「さらっさらでツヤツヤ」と褒められます
もっとはやく出会いたかったホームトリートメントも購入したので,原因・理由,予約した時の倍以上の金額になりましたが、
予約した時の倍以上の金額になりましたが、,逆接,それでもまったく高くないというか、
サービスや仕上がりに心の底から満足できるので、,原因・理由,それでもまったく高くないというか、
久しぶりのカットでしたが,逆接,とても満足です
カラーもお任せでしたが、,逆接,すごく綺麗でお気に入りの色にしてもらえました
