原因,関係,結果
今回もカラーも今どきな雰囲気に仕上がったので,原因・理由,良かったですまたよろしくお願いします♪
シャンプーを使っていただいたので、,原因・理由,来月またよろしくお願いします
丁寧でした、仕上がりは満足とはいきませんが、,逆接,接客は今後も来店する予定です
素敵に見えましたが、,逆接,出来上がりは式の途中で崩れてしまいました
とても大事な友達の式だったので、,原因・理由,アレンジが不慣れなら他のスタッフの方にもサポートいただきたかったです
迷ってたのですが,逆接,良かったです
いつも違う方に担当していただいているのですが、,逆接,前髪のサイドの髪がオーダー通りになったことがありません
言ったのですが、,逆接,よく見たら形も前髪とサイドの毛の境目が段みたいになってました
とって前髪は顔のパーツの一部なので、,原因・理由,もっと研究していただきたいと思いました
今後も通いたいので、,原因・理由,改善していただければいいなと思います
うかがいますので,原因・理由,よろしくお願いします
予約した料金より上がりましたが,逆接,大変助かります
のは意外と他のお店は無かったりするので,原因・理由,大変助かります
朝一番での予約でしたが、,逆接,施術時間は驚異の3時間少々
手際の良さと完成度の高さは、正に脱帽の域なのですが、,逆接,有り難うございました
今後も引き続きお世話になりますので、,原因・理由,どうぞよろしくお願いいたします
暑いため、,原因・理由,ショートボブからショートヘアにイメチェンしました
時間がなく急がせたにもかかわらず、,逆接,ありがとうございました
10年ぶりくらいの縮毛矯正で少し不安でしたが、,逆接,本当にいつもありがとうございますよろしくお願いします
なかなか言葉では伝えられないのですが、,逆接,ありがたいです
優しい雰囲気の方なので,原因・理由,ありがたいです
口コミ遅くなってしまいましたが、,逆接,よかったです
とても丁寧な施術でしたブリーチ毛で毎日アイロンを使っているので,原因・理由,ダメージもあったのですが
ダメージもあったのですが,逆接,綺麗に癖を伸ばしていただきました
今回もまたかなり日にちを空けて行ってしまいましたが,逆接,大変満足でした
頭皮が悲鳴をあげますが,逆接,無痛です
困ってますが,逆接,もうすこし頑張って教えて頂いたセットのやり方を上手に出来るように頑張りたいと思いますまた
近々行くので,原因・理由,その際にはまた、よろしくお願いします本当に大大大満足です
担当していただいたのに、,逆接,久々に楽しい時間を過ごさせていただきました
表示通りの時間で終わったので,原因・理由,良かったです
今までくせ毛が強いためかトリートメントの効果を実感したことがなかったのですが,逆接,まだしっとりしています
オイリーなので、,原因・理由,もう少し軽めでも良かったかなというくらい効いています
サラサラになったので,原因・理由,良かったです
また近々縮毛矯正かけに行くので、,原因・理由,よろしくお願いします
1ヶ月で思った以上に伸びてるので,原因・理由,毎回びっくりします
貰いましたこれから暑くなるので、,原因・理由,軽くなってすっきりしましたシャンプー・トリートメントも気持ちよかったですまたお願いします
いつもですが、,逆接,軽くなってすっきりしましたシャンプー・トリートメントも気持ちよかったですまたお願いします
初めて担当の方でしたが,逆接,丁寧に仕上げていただきました
髪のダメージとかも良く考慮してくれるので、,原因・理由,安心してお任せできます
お席がたまたま空いたため、,原因・理由,配慮をしてもらったりと、
今までの縮毛矯正だとヘアアイロン必須だったのに、,逆接,すごく楽になりました本当に良いお店に出会えて
雰囲気の若いお店で入店時は少し戸惑ったのですが、,逆接,とても安心しながら時間を過ごす事ができました
毎回細かなオーダーを全て叶えてくれるので,原因・理由,安心です
たくさん会話するのは苦手ですが,逆接,いつもちょうど良い接客で施術受けやすいです
のは承知ではありますが、,逆接,こちらに書かせて下さい
問題なかったので,原因・理由,これでは了承しました
くらいと言ったのに,逆接,切りすぎだし、
どちらも1発で切られてしまったので,原因・理由,止めることはできませんでした
ロングヘアがお気に入りだったので,原因・理由,私は残念です
癖毛が目立つようになったので、,原因・理由,久しぶりに縮毛矯正していただきました
大変満足しています髪の毛の悩みは尽きないですが、,逆接,髪のお医者さんのようです
癖毛も驚くほど真っ直ぐになるので、,原因・理由,髪のお医者さんのようです
照れましたが,逆接,すごく嬉しかったです
初めて利用しましたが,逆接,スタイルに仕上げて頂きました
ダメージがひどく広がってしまうので、,原因・理由,TOKIOをしていただきました
これまで色々な美容室で施術をしてもらいましたが、,逆接,仕上がりでした
夜遅くの予約にも関わらず,逆接,まず、快く接客してくださりありがとうございました
本来はカットとトリートメントを希望していたのですが、,逆接,トリートメントのみの予約をしたのですが、
閉店1時間前の予約だったので、,原因・理由,トリートメントのみの予約をしたのですが、
トリートメントのみの予約をしたのですが、,逆接,希望していた髪型に完璧にカットしてくれました
約3年ぶりにカットをしたのですが、,逆接,担当スタイリストさんも一緒に喜んでくれました
ずっと思っていました…笑笑丁寧にトリートメントしていただいたおかげで、今回は指名なしで予約しましたが、,逆接,施術後に担当スタイリストさんのページを見ると
縮毛矯正もしていますが,逆接,とても良かったです
毛先が眼の周りに触るので、,原因・理由,前髪を短くカットしていただきました
いつもは決まったスタイリストさんを指名していますが,逆接,指名なしで予約しました
お店にかなり早く着いてしまったにもかかわらず、,逆接,すぐに対応してくれました
今回担当して頂いたスタイリストさんは初めてでしたが、,逆接,仕上がった色味もとても良かったです
以前も指名なしで予約したことがありますが、,逆接,お店です
仕上がりでしたので、,原因・理由,お店です
ごめんなさい…今月中にカラーもお願いしたいので、,原因・理由,その際もよろしくお願いします
今回は、ので (15センチくらいですが,逆接,気がします
イメチェンできてよかったです前髪と毛先もやっと重めにカットできたので,原因・理由,気がします
途中経過からも、ことが分かったので、,原因・理由,寝てしまいました
美容室の担当の方が転勤になった為,原因・理由,こちらに伺いました
仕上がりも怪しい感じだったのですが、,逆接,度ため息が出ます
縮毛矯正しに行ったのに傷むから,原因・理由,年に何回かと決めて行っているのに
半分から下はボサボサですあまり悪くは言いたくないですが,逆接,度ため息が出ます
トリートメントも久しぶりだったので,原因・理由,感じがします
またお世話になるかと思いますので、,原因・理由,よろしくお願いいたします
今回もシャンプー最高でしたカットはしませんでしたが,逆接,ありがとうございました
ただ行きやすそうって理由だけでオーブさんのヘアセットを予約しましたが,逆接,尚且つスムーズな施術、お会計の流れはまた行きたいと思わせるほど
半年ぶりだったので,原因・理由,縮毛矯正は、キレイにストレートにして頂きました
安心して任せられるので,原因・理由,助かります
デザインに悩んでいましたが、,逆接,縮毛矯正とトリートメントで、ずっと触ってたくなるくらいすごいサラサラ艶々になりました
相談に乗ってくれたので,原因・理由,縮毛矯正とトリートメントで、ずっと触ってたくなるくらいすごいサラサラ艶々になりました
ここ1年くらい左右非対称に仕上げてもらっていましたが,逆接,今回は一旦リセット、
ショートにしたので,原因・理由,とても満足しています
今回カットは全体を整えて貰ったのですが、,逆接,左右をきちんと同じバランスにしてくれました
それからトリートメントのお陰で髪がスルスルになったので、,原因・理由,今はスタイリングがラクになりましたし、
気付いたら寝てしまってることが多いのですが,逆接,来月もお願いします
縮毛矯正をした事がなく不安でしたが、,逆接,天パの僕が感激しました
初めての来店でしたが,逆接,指名して予約しました
口コミで評価が高かったため,原因・理由,指名して予約しました
垢抜けたいが,逆接,私のようなタイプには、わかりやすく丁寧なカウンセリングとスタイリングのご提案は、本当にありがたいものでした
シャンプー台での体勢も恐る恐るでしたが、,逆接,問題なく出来ました
癒されに伺いますので,原因・理由,次回も宜しくお願い致します
傷んできたので、,原因・理由,暗めのカラーにしていただきました
シャンプーは頭皮マッサージされているみたいで個人的によかったのですが、,逆接,もう少しガシガシやっていただいても良いと思いました
残しがあったので,原因・理由,もう少しガシガシやっていただいても良いと思いました
また伺いますので,原因・理由,よろしくお願いします
サラサラになるので、,原因・理由,いつも髪が行って良かったと思っています
縮毛かけてるんですが、,逆接,縮毛するスパンが短くなりましたおすすめです
以前利用していた店舗が閉店してしまったので、,原因・理由,系列店のこちを選びました
気持ちもありましたが、,逆接,利用しようと思います
お店の雰囲気も良く過ごしやすかったので、,原因・理由,利用しようと思います
初めてでしたが,逆接,仕上がりも良くしてくれました
伸びた髪を綺麗に整えて頂いたので、,原因・理由,一日中気分良く過ごせました
状態でしたが、,逆接,できないと突き放すわけでもなく最後まで丁寧に向き合っていただきました
そろそろカットでイメージチェンジがしたいので、,原因・理由,次回は、相談にのってください
予約のメニューを間違えてしまったのに、,逆接,対応してくださり感謝です
シルエットがうーむ…という印象だったので、,原因・理由,やっぱり、次回からはいつも通りにしてみます
暗めのカラーでお願いしましたが,逆接,いつもお世話になっております今回はとってもいい色で気に入ってます
初めてお願いしましたが、,逆接,カラーはもちろん、スタイリングの仕方も丁寧に丁寧に教えていただけました
前回パーマをかけたので、,原因・理由,現状の扱いにちょっと苦労していたので、
現状の扱いにちょっと苦労していたので、,原因・理由,大変助かりました
初めて利用しましたが,逆接,とても満足のいく仕上がりにしていただけました
久しぶりのヘアカラーだったため、,原因・理由,お店へ向かってしまいましたが、
お店へ向かってしまいましたが、,逆接,髪色になりました
アクセスもわかりやすかったので,原因・理由,大変便利でした
こちらの伝え方も不十分だったかもしれませんが、,逆接,短く切られました
今回もリタッチをお願いしましたが、,逆接,綺麗な仕上がりで満足しています
私の髪が変な風に傷んでいたせいで,原因・理由,たくさん時間がかかってしまったのですが
たくさん時間がかかってしまったのですが,逆接,最後まで丁寧に施術してくださり感謝ですまた伺います
前髪が癖が強いので,原因・理由,くりくりしてきて嫌だなぁと思っていたので
くりくりしてきて嫌だなぁと思っていたので,原因・理由,自然に真っ直ぐにしてもらって大満足です
夜勤明けで眠気がすごかったのですが、,逆接,希望通りに綺麗に仕上げてくださいました
だいたいのイメージでお伝えしましたが、,逆接,満足する仕上がりで嬉しいです
初めての来店でしたが,逆接,とても満足のいく施術でしたカラーもヘアスタイルもとても良かったです
転勤等ございましたが、,逆接,のは初めてです
長いキャリアをお持ちでベテランさんですが、,逆接,担当者様は、物腰が柔らかく安心してお願い出来ます
夏前頃カットをお願いするので,原因・理由,また、どうぞ宜しくお願い致します
髪型を提案していただけるので、,原因・理由,とても嬉しいです
あと縮毛矯正について悩んでることがありましたが、,逆接,縮毛矯正かけてみたいなと思ってます
良い解決策を提案してもらえたので、,原因・理由,縮毛矯正かけてみたいなと思ってます
いつもありがとうございます前髪の白髪がやはり染髪5日目ですが,逆接,色が気になり出してきましたが、
色が気になり出してきましたが、,逆接,髪はとてもツヤツヤしていて扱いやすいですまたよろしくお願いします
髪の毛だったのですが、,逆接,していただいたトリートメントが思っていた以上にすごく気に入っています
派手で長い髪が好きだったのですが、,逆接,今回のように短く黒くしても悪くないなと思いました
いつも同じ髪型で、長さだけ変更していたのですが,逆接,髪型にしてみたいと
レイヤーを入れて貰ったのですが,逆接,初めて、良かったです
困っていたので、,原因・理由,嬉しいです
永久指名しますねって口に出してしまう程の技術があるので、,原因・理由,提案してくれたり私に似合うように完璧に仕上げて下さいます
後頭部のうねりがやっぱり気になるので、,原因・理由,次回は縮毛矯正かな
リタッチとカットをしましたが、,逆接,満足な仕上がりになりました
久しぶりの来店でしたが、,逆接,今回も大満足です
のは勇気が必要ですが、,逆接,大満足の仕上がりです
ありがとうございました久しぶりのカットで少し緊張していましたが,逆接,ホッと出来ましたトリートメントで髪がツヤツヤになりました
安心して任せていられるので、,原因・理由,寝てましたいつもありがとうございます
カットとカラーの予定でしたが、,逆接,求めていたカラーが難しいとの
途中からあまりにも雑なため、,原因・理由,もういいです、と
雰囲気でしたので、,原因・理由,技術力がもう少しだったらなぁと
初めての来店でしたが,逆接,行ったのですが
行ったのですが,逆接,担当された方の気遣いがほんとに素晴らしかったです
久々に切りましたが,逆接,扱いやすく気にいりましたカラーも周りにいつも褒められます
パーマなので,原因・理由,次回は楽しみですよろしくお願いします
何年も通っていますが,逆接,いつも綺麗にして頂いてます次回もよろしくお願いします
今まで色々な美容室で縮毛をしましたが、,逆接,やっと信頼出来る美容師さんに出会えたなと思っています
半年に1度は何度もお願いしているので、,原因・理由,とても信頼しています
頭皮が弱いので、,原因・理由,丁寧にありがとうございます
明るくならなかったのですが、,逆接,伝えると
色が気に入っていた為、,原因・理由,リタッチしてもらいました担当の方も落ち着いていて安心して施術を受けられました
のは自分でも分かる程だったので,原因・理由,断られるかも
と思いながらドキドキでしたが、,逆接,無事に施術して頂きました
初の来店で緊張していましたが,逆接,良かったです
無いので,原因・理由,静かに施術していただけたのも助かりました
のも変ですが、,逆接,凄く良いです
何年かぶりのパーマで少し不安でしたが,逆接,よろしくお願いします
大満足です札幌に行きつけのサロンがなかったので、,原因・理由,これからは髪を保っていきたいと思います
丁寧に対応して頂きましたが、,逆接,一つ残念な事がありました
髪型についてのカウンセリングは小まめに挟んで頂けましたが、,逆接,雰囲気がとても自分には好印象でした
ありがとうごさいました又是非次も予約しますので、,原因・理由,合わせて本当に満足出来ました宜しくお願いします
ドライヤーでとても熱かったりしたので,原因・理由,しかし、今後少し気をつけて頂きたいと思いました
パサついていたので、,原因・理由,ちょっと良いタイプに変更して頂きました
料金は追加になりましたが、,逆接,ツルツルサラサラに仕上がりました
初めて伺いましたが、,逆接,丁寧に施術していただき満足です
場所が行きやすそうだった為,原因・理由,こちらの店舗を利用しました
少しすいてほしいとお願いしましたが、,逆接,思ってた以上にすかれてしまった
気づいたのですが,逆接,右耳にカラー剤がベットリついていました
色味も他の店だとトーンを選べたのに、,逆接,そういう選択肢がなかったので
そういう選択肢がなかったので,原因・理由,?と確認しましたが
?と確認しましたが,逆接,不満を感じました
初めてでしたが、,逆接,ありがたかったです
遅くまで営業していたので,原因・理由,ありがたかったです
初めての利用でしたが、,逆接,終始とても丁寧な担当さんでした周りの方はとても助かりました
印象でしたが、,逆接,終始とても丁寧な担当さんでした周りの方はとても助かりました
前回から一ヶ月以上経っていたので,原因・理由,かなり伸びましたが、
かなり伸びましたが、,逆接,今回は襟足も刈り上げてもらいました
人生初のパーマでしたが、,逆接,理想以上に周りからも好評でしたすごく嬉しかったですまたお願いします
マッサージ苦手ですが、,逆接,事前にお願いします
スムーズに作業していただけるので,原因・理由,いつもありがたいです
前髪と顔周りの毛がすごく傷んでしまって悩んでいましたが、,逆接,嬉しかったです
髪が真っ直ぐになったので,原因・理由,嬉しかったです
来店しましたが、,逆接,丁寧な接客でした
とても久しぶりにお邪魔しましたが、,逆接,明日から実践しようと思います
スタイリングの仕方も、とても丁寧にわかりやすく教えてもらったので,原因・理由,明日から実践しようと思います
思い切ってショートヘアにしましたが、,逆接,とても満足な仕上がりでしたいつもありがとうございます
黒染め後の残留もありましたが,逆接,とても満足の次回もぜひご利用させていただきます
高い技術で上手くカバーしていただいたため,原因・理由,とても満足の次回もぜひご利用させていただきます
過去に縮毛矯正2回、黒染め、ブリーチ歴ありましたが,逆接,対応して下さいました
最近前髪の癖が気になってましたが、,逆接,行きましたが、
ブリーチ歴などあったので,原因・理由,行きましたが、
行きましたが、,逆接,真っ直ぐになって有難かったです
カウンセリングを丁寧にしていただいたので,原因・理由,安心してお任せできました
お願いしましたが、,逆接,出来上がりは画像通りでした美容室の帰りに友達に会いましたが、
出来上がりは画像通りでした美容室の帰りに友達に会いましたが、,逆接,髪の色も褒められました
何度もお願いしていますが、,逆接,これからもよろしくお願いします
何ヶ月も染めていなかったので,原因・理由,かなり気になっていたので
かなり気になっていたので,原因・理由,きれいに染めて頂いて良かったですまた次回もよろしくお願いします
確認しながらカットしてくださったので,原因・理由,ありがとうございました
悩みがたくさんありましたが,逆接,のもセットが簡単に出来ています
いつもの長さ (結べないほどのショートボブ)のカットお願いしましたが、,逆接,快く今まで以上にセットしやすいですし、
初めての利用でしたが、,逆接,丁寧なサービスでカラーもカットも満足です
なかなかしょっちゅうは通えないのですが、,逆接,ちょうどよい感じにさせてもらってます
顔まわりのカットのみでしたが、,逆接,大満足の仕上がりでした次回もこちらにお世話になろうと思います、
髪の毛をまとめてもおろしても可愛い感じにカットしてくださったので,原因・理由,大満足の仕上がりでした次回もこちらにお世話になろうと思います、
前回カットのみだったのですが、,逆接,今回も利用させていただきました
とても気に入ったので,原因・理由,今回も利用させていただきました
安心して任せられるので,原因・理由,助かります
前回は毛量を薄くしていただいたので、,原因・理由,実際の量を次回毛量調整しましょうとアドバイス頂きました
予定所要時間が2時間半でしたが,逆接,驚きました
のが初めてなので,原因・理由,驚きました
以前、お店の雰囲気や立地も良いので、,原因・理由,今回は初めてカットカラートリートメントで伺いました
ミディアムからショートにバッサリ切りましたが,逆接,ナチュラルで似合ってるねと
久しぶりだったのですが,逆接,綺麗にしてもらいました
美容室の後に予定があったので、,原因・理由,綺麗にしてもらいました
色を全く決めずに行きましたが、,逆接,めちゃめちゃ可愛く仕上げてくれましたもう少し頑張って伸ばします笑今回もありがとうございました
いつもすぐに切ってしまうので、,原因・理由,めちゃめちゃ可愛く仕上げてくれましたもう少し頑張って伸ばします笑今回もありがとうございました
初めてでしたが、,逆接,ありがとうございますシャンプーやトリートメントも丁寧で良かったです
三が日に営業されていたので,原因・理由,予約して伺いました
末筆となりますが、,逆接,改めて、今年もよろしくお願い致します
少し不安でしたが、,逆接,楽しい時間になりました
髪を伸ばしたかったので,原因・理由,毛先のみのカットでしたが、
毛先のみのカットでしたが、,逆接,ここでカットしてもらいたいと思います
毎回施術してもらうたびに長くなってるかと思いますが、,逆接,それでも毎回綺麗にしてもらえてますありがとうございます
