原因,関係,結果
ダメージ的にできなかったかもしれないけど、,逆接,黒髪になっていたし、
初めてのイヤリングカラーでしたが,逆接,ありがとうございます
料金はほかのカットに比べて少し高いですが、,逆接,仕上がりに満足しています
周りからも好評なので、,原因・理由,次回もまたお願いしたいと思います
行ってみたかったので,原因・理由,お邪魔しますありがとうございました♪
楽しくお話しできるので,原因・理由,いつもありがとうございますリラックスできました
仕上がりもかなり良かったので,原因・理由,大満足です
初めてのカラーで不安でしたが,逆接,髪色を決めることができました
初めて全頭ブリーチで青にしましたが、,逆接,切れ毛は感じにおさまってくれてます
縮毛矯正していたので,原因・理由,ダメージが心配でしたが、
ダメージが心配でしたが、,逆接,切れ毛は感じにおさまってくれてます
するものの,逆接,切れ毛は感じにおさまってくれてます
ずらい髪質ですが、,逆接,しっかりかけてくださいました
周りからも大好評なので,原因・理由,凄く嬉しいですまたよろしくお願いします
暑くなってきたので,原因・理由,短めにしました
インナーカラーの色をお任せしたんですが、,逆接,嬉しいです
前回の色落ちも気に入ってたので、,原因・理由,もうちょっと先でもいいかなと思ってたけど、
もうちょっと先でもいいかなと思ってたけど、,逆接,良かったなと思いました
カットやカラーを、少し変えたのですが、,逆接,大満足です白髪も黒髪部分も今までより少し明るくなり、
仕上げで、してみたかった巻き髪をしてくださったので、,原因・理由,夫に褒められました
お店の雰囲気も、混んでいたのですが、,逆接,お任せできました
来店するのは2回目だったのですが、,逆接,仕上がりにしてもらいました
担当スタイリストさんなら信頼しているので,原因・理由,行くのがワクワクでした
私の事情で予約時間が過ぎてしまいましたが、,逆接,仕上がりも良かったです
初めてのカラーで緊張していたのですが、,逆接,とても満足ですありがとうございました
雰囲気の方で色にしていただけたので,原因・理由,とても満足ですありがとうございました
ほんと安心してお任せしてしまうので、,原因・理由,今回もありがとうございました全然何も申し訳ないです笑
【ブリーチ・潤いカラー】初めてのブリーチだったのですが,逆接,とっても嬉しいです
髪の乾かした方や、セットの方法を教えてもらったので、,原因・理由,実践したいと思います
全頭カラーしていただきましたが、,逆接,とても満足しました
想像以上の仕上がりで大満足ですいつも美容師の方とはあまり会話をしないので、,原因・理由,人たちでしたまた行きます
久しぶりにインナーいれたので,原因・理由,楽しみたいと思います
提案して下さるので,原因・理由,イメージにしてくれます
普段口コミなどは滅多に書かないのですが、,逆接,書かせて頂きます
想像以上に仕上がりが酷かったので,原因・理由,書かせて頂きます
要望しているにも関わらず、,逆接,カット方法も雑なように見受けられました
以前1200円でカットして頂いた時に同じような失敗をされた事がありますが、,逆接,5500円でこのクオリティはどうかと
最後にですが,逆接,ハサミを研ぎに出しておりないとのことでしたが
ハサミを研ぎに出しておりないとのことでしたが,逆接,それはいいことなのかと
5回ほどカットしてもらいましたが、,逆接,後悔したことがないです
感じたので,原因・理由,上での書かせていただきました
髪色を暗くしたかったのですが、,逆接,すごく悩んだのですが
すごく悩んだのですが,逆接,最終的にすごく楽しかったですまた行かせて頂きたいと思います
初めての来店なのに,逆接,急に予約したにもかかわらず、
急に予約したにもかかわらず、,逆接,お願いしてよかったです
緊張していてちゃんと話せなかったので,原因・理由,不安もありましたが、
不安もありましたが、,逆接,お願いしてよかったです
心配でしたが、,逆接,とても可愛く仕上げて頂きました
2時間予定でしたが,逆接,1時間ほどで終わり、
黒染めしてないけど、,逆接,とてもかわいい色にしてくださいました
カラーしたあとなのに,逆接,髪がきしむことなく、
髪色暗くするの嫌だったんですけど、,逆接,次回もお願いします
担当さんの移動で初めて行きましたが,逆接,お店でしたカラーもカットも毎回大満足です
はじめてインナーカラーしましたが、,逆接,満足です
追加料金でトリートメントをグレードアップしていただきましたが、,逆接,凄く良かったです
還暦前の妻が利用したのですが、,逆接,髪質ともに大満足しておりました
入れたにもかかわらず、,逆接,前日に急に予約を温かい対応とイメージ通りの仕上がりに満足しています
初めて来店して緊張と不安もありましたが,逆接,合わせてありがとうございましたよろしくお願いします
久しぶりのカット、初カラーだったのですが,逆接,今でも髪はサラサラです
可愛く仕上げてもらいましたトリートメントもしてもらったので,原因・理由,今でも髪はサラサラです
納得のいくスタイルになったので,原因・理由,良かったですありがとうございます
ブリーチもしますねとの事でしたが、,逆接,待ち時間中一回も確認はなかったです
シャンプー等は指名の方ではなく他の方が担当でしたが、,逆接,慌ててお伝えしたのですが
儘シャンプーとシャワーをされたので,原因・理由,慌ててお伝えしたのですが
慌ててお伝えしたのですが,逆接,これも笑いました
髪に対してのアドバイスや技術は高かったので、,原因・理由,大変残念です
頭の形や髪質など、考えてやってくださるので,原因・理由,安心して任せられます
美容室選びがとても難しいのですが、,逆接,大変満足しています
ふわっとした内容しかお伝え出来なかったのに,逆接,一つ一つ丁寧に相談に乗って頂き
髪質改善も気になっていたので、,原因・理由,次はお願いしようと思います
2年ぶりにカットして頂きましたが、,逆接,髪型を訂正してくれました
初めて伺いましたが、,逆接,安心してお願いすることがきました
担当の方が対して明確に答えてくださるので,原因・理由,安心してお願いすることがきました
シャンプーの時若干くつろぎづらかった点と、バタバタされていたので,原因・理由,施術の丁寧さは大丈夫なのかと
髪の量も多いですが、,逆接,私は広がらないヘアスタイルにカットしてもらえます
イメージチェンジをしましたが、,逆接,今回はとても気に入っています
ほぼお任せでカラーを決めてもらいましたが,逆接,楽しみにしています☆
素敵に仕上げていただきました次はまたブリーチ予定なので,原因・理由,楽しみにしています☆
感じだけど、,逆接,旅行もお願いします♪
好きな雰囲気にしてくれたので,原因・理由,嬉しいです♪周りからも感じにしてくれたので、
嬉しいです♪周りからも感じにしてくれたので、,原因・理由,旅行もお願いします♪
仕上がりも大満足でしたインナーカラーで濃いめに色を入れてもらいましたが,逆接,とても良かったです
行くまではドキドキでしたが,逆接,大変素敵な時間を過ごさせて頂きました
時間が遅かったにも関わらず,逆接,丁寧に接客して頂けました
感じに仕上げてくれるので,原因・理由,セットが楽です
頭皮が敏感なので,原因・理由,パーマを初挑戦しました
担当スタイリストさんに敏感なので,原因・理由,真摯にご対応していただけました
はじめて利用させて頂きましたが、,逆接,とても良かったです
時間が思ったよりかかってしまいましたが、,逆接,とっても満足のいく仕上がりで嬉しいです
○番と○番の間という微妙な色をお願いしたのですが、,逆接,完成後が良かったです
数年苦しんでいましたが、,逆接,やっと変えることが出来て良かったです
想像していたより、ヘアダメージも少なかったので、,原因・理由,これからは、色々なヘアカラーを楽しみたいです
直後に遠出の予定があったのですが、,逆接,とてもしあわせでした
初めてでしたが、,逆接,カラーやカットについて相談にのっていただけました
のは個人店じゃないので,原因・理由,分かりますが、
分かりますが、,逆接,感じになってしまうと思うので、
感じになってしまうと思うので、,原因・理由,塗ってすぐとか、あたりとか担当者が確認に来るなどの対応が欲しいです
塗ってる人は担当者じゃないので、,原因・理由,何を思ってる以上に赤強いですね?って伝えました
トリートメントカラーだからいけるのか思いましたが、,逆接,伝えた色にはなりませんでした
後ろの髪も伝えましたが,逆接,切ってないのかバラバラです
担当者さんは相談すると説明もしっかりしてくれてただけに、,原因・理由,忙しすぎてキャパオーバーのミスな感じがしてなりませんでした
1日の中の1人のお客ですが,逆接,お客さん何日も、その髪型を毎日見ます
初カラーでしたが,逆接,安心して髪染めが出来ました
わかりやすく説明してくださるので,原因・理由,ためになります
いつもの方にしかなれてなかったので,原因・理由,緊張しましたが、
緊張しましたが、,逆接,お世話になりたいと思います
染まりにくい髪質なのですが,逆接,想定時間よりも長引くと思っていたのですが
丁寧に施術していただきましたカット、カラー、パーマ、トリートメントとフルでのメニューだったので,原因・理由,想定時間よりも長引くと思っていたのですが
想定時間よりも長引くと思っていたのですが,逆接,お願いしようと思います
ありがとうございます育児の合間に行くので、,原因・理由,とても助かります
今回、仕事の関係で細かくオーダーしたにも関わらず、,逆接,大満足です1週間経ちましたが、
大満足です1週間経ちましたが、,逆接,髪の毛がサラサラですこれで仕事を乗り越えられそうです本当にありがとうございました
初めてのパーマでしたが,逆接,自分の想像してた以上にかっこよく仕上げてもらいました
施術から2週間ほど経ちましたが,逆接,色落ちが全くなく楽しんでます
今回初めての色味に挑戦したんですが,逆接,安心してお願いできます
大満足でしたいつも丁寧なカウンセリングをしてくださるので,原因・理由,安心してお願いできます
久しぶりに来店して初めてケラチントリートメントしましたが、,逆接,ありがとうございました
言われたので、,原因・理由,パーマの仕上がりは悪くなっても仕方ないかなと思い、
何も思いませんでしたが、,逆接,後ろ髪はガタガタになってしまいました
ずっと楽しみにしていたので,原因・理由,悲しかったです
タイプですが、,逆接,他の美容室で直してもらいました
髪の長さが中途半端なのですが、,逆接,いい感じにならなくても仕方ないのかな、と
今は伸ばしているので、,原因・理由,いい感じにならなくても仕方ないのかな、と
半分あきらめていましたが、,逆接,すごく満足感の高い仕上がりにしてくれました
癖毛なので、,原因・理由,トリートメントで、よかったです
カットとカラートリートメントをお願いしたのですが,逆接,全て丁寧に行ってくれましたなりたい髪型のビジョンが来店したのですが、
全て丁寧に行ってくれましたなりたい髪型のビジョンが来店したのですが、,逆接,とても丁寧に話を聞いてくださりました
前回と同様ボブにして頂いたのですが、,逆接,理想通りの仕上がりで満足しています
のに初めて書くんですけど,逆接,担当スタイリストさんオススメですカッコ可愛くもしてくれるし
ブリーチ毛で量も多かったのですが、,逆接,嬉しいです
初めて来店する美容室でとても緊張しましたが,逆接,大満足です
また次回の仕上がりが楽しみですこれから通わせて頂きますので,原因・理由,宜しくお願いします
初めての来店でしたが,逆接,良かったです
間違い無いので,原因・理由,安心してお願いしています今回はバッサリ切りましたが
安心してお願いしています今回はバッサリ切りましたが,逆接,良い感じですまた次回もよろしくお願いします
ことが多いですが、,逆接,ショートでもこんなに色々できるんだなーと
あとのカラーでしたが,逆接,可能な限り馴染むように染めていただきとてもありがたかったです
ケアブリーチとトリートメントのおかげでダメージもさほど気にならなかったので,原因・理由,大満足でしたまた利用させていただきます
久しぶりに前髪作りたいけど,逆接,幼顔にはなりたくないと
今回2回目でしたが、,逆接,今回もとっても素敵にして頂きました
後はお任せでカラーして頂きましたが、,逆接,ここの美容室は来月もお願い致します♪ありがとうございました
大満足です安心してお任せ出来る美容師さんです今まで美容室をリピートする事が無かったのですが、,逆接,ここの美容室は来月もお願い致します♪ありがとうございました
のにも関わらず,逆接,素敵に仕上げて頂きましたカラーは感じです
初めての美容室でのカラーだったので,原因・理由,緊張していましたが、
緊張していましたが、,逆接,とても良かったです髪色は色に染めていただきました
合わせて居心地の良い雰囲気を作ってくださるので,原因・理由,安心します
美容室を転々としていましたが、,逆接,引き続き宜しくお願い致します
中々浮気する気になれないので,原因・理由,引き続き宜しくお願い致します
久しぶりに行きましたが、,逆接,よかったです
カラー変更にも対応してもらえたので,原因・理由,よかったです
長さも短くしましたが、,逆接,ざっくりとしか決めれました
2回目の来店でしたたまたま有休だったので,原因・理由,これ似合うと思いますとか
似合うようにカットしてくれるので,原因・理由,周りからの評価も感覚です大袈裟ですけど
周りからの評価も感覚です大袈裟ですけど,逆接,担当の方のカット&アドバイスさすがプロですぜひおすすめですまた宜しくお願いします
悩んでいてお待たせしてしまったのですが、,逆接,来ます
初めてのパーマで緊張していましたが、,逆接,とってもよかったです
予約時に何点か要望を書かせていただいたのですが、,逆接,全て希望通りの仕上がりにしていただきました
頻繁に通うことが難しいですが、,逆接,よろしくお願いしますありがとうございました
行ってますが,逆接,必ず満足するスタイルに仕上げてくださいます
スタンダード?なカラー剤だと痛みやすいのですが、,逆接,とても嬉しいです
初めて担当していただきましたが、,逆接,嬉しいです
いつも急に行くことを決めるので,原因・理由,ヘアサロンは空いているやすいところにしていますが、
ヘアサロンは空いているやすいところにしていますが、,逆接,ここが一番仕上がりも雰囲気も好きです
不安になりましたが、,逆接,利用させて頂きたいと思います
友達の紹介で行きましたが、,逆接,大変満足でした
ブリーチかカラーをしてもらってますが,逆接,不満はありませんが
不満はありませんが,逆接,いまいち納得行かず……
泡パーマ初めてですが、,逆接,楽しみです
初めて行く美容室だったので,原因・理由,大変助かりました
不安でしたが、,逆接,大変助かりました
時があったので、,原因・理由,その時に付着したのではないかと思います
仕上がりがとても満足だっただけあって、,原因・理由,この点はとても残念でした……
初めての札幌の美容室で少し緊張してたんですけど、,逆接,上手に教えてください
想定していたカラー通りにはならなかったのですが、,逆接,綺麗に色落ちして良かったです
初めての美容室利用だったのですが、,逆接,対応してくださりとても満足出来ました
初パーマだったのですが、,逆接,とっても親切でした
いつも本当にありがとうございますまた利用するので,原因・理由,お仕事頑張ってください
しっかり汲み取って頂けるので、,原因・理由,とても信頼できるスタイリストさんです
有難かったです最初は緊張していたのですが、,逆接,楽しくお話しながら施術することが出来ましたし、
後れ毛と顔周りのカットをしていただいたんですけど、,逆接,本当に嬉しかったですトリートメントのおかげで髪もサラサラになりました
めちゃくちゃサラサラで大満足ですすごく混んでたので,原因・理由,のが残念ですが、
のが残念ですが、,逆接,それ以外は満足でした
傷んでいる箇所を切っていただいたので、,原因・理由,髪の毛の手入れが楽になりました
今回もありがたいですなるべく混んでる時避けようと思ってたのに,逆接,申し訳ないですことが…アイロンのサイズが…
今回も伺いましたが、,逆接,的確なアドバイスのもと、インナーカラーを綺麗なくすみOlive\colorにして頂きました
ブリーチをやめている最中で無理難題ばかり言ってしまったのですが,逆接,時間も待たされるということがなかったので
時間も待たされるということがなかったので,原因・理由,とてもありがたかったです個人的に眠たい状態で行ってしまったのですが
とてもありがたかったです個人的に眠たい状態で行ってしまったのですが,逆接,とても助かりましたまたお願いします
申し訳ない毎回お任せですが,逆接,大満足な仕上がりありがとうございます♪今回も『カッコいい』と
要望をざっくりお伝えしたにも関わらず、,逆接,今回も素敵に仕上げて頂きありがとうございます
ブルーブラックのような色を一度やってみたかったので,原因・理由,満足です色落ちも楽しみです♪今年もありがとうございました
あまり巻いたりはしなかったのですが、,逆接,前回のカラーの後からヘアアレンジもとても楽しいです
最高のサロンですもう3年通っていますが,逆接,他の美容室に通え
12/25日クリスマスに行きましたが,逆接,担当スタイリストはクリスマスツリーの格好をしていました
髪の毛の話ですが、,逆接,私の髪は痛み&赤みがでていたのですが
私の髪は痛み&赤みがでていたのですが,逆接,オーダーしました
真逆のオリーブ系にしたかったので,原因・理由,オーダーしました
かなり難しかったようですが,逆接,担当スタイリストの手によって素晴らしいオリーブ色に発色してくれました
初対面なので,原因・理由,私も悪かったのですが、
私も悪かったのですが、,逆接,ビックリしました
いつも細かいヒアリングと美容師さんのセンスでオシャレに仕上がってるので,原因・理由,多少高額でも価値を感じていたのですが
多少高額でも価値を感じていたのですが,逆接,今回は残念でした
初めての利用でしたが、,逆接,とても嬉しかったです
毎回微妙な気持ちで帰っていましたが,逆接,ロングからカラーもして頂いたのですが
ロングからカラーもして頂いたのですが,逆接,大満足です次回指名でまた行きたいです
カンジに仕上げてくれるので,原因・理由,お願いします
初めての美容室で緊張しましたが,逆接,本当に来て良かったです
とても優しくご対応していただいたので,原因・理由,セットとかのアドバイスもたくさんしていただいたので、
セットとかのアドバイスもたくさんしていただいたので、,原因・理由,本当に来て良かったです
予約していたので,原因・理由,確認を先にして欲しかったなと思いました
そのあとカットに移りましたが、,逆接,とても安心して任せることができました
担当の方が丁寧に説明しながら切ってくれたので,原因・理由,とても安心して任せることができました
薬品の説明などもしてくれたので,原因・理由,とても良かったです
そのあと髪の乾かし方やセットの仕方などまで詳しく説明してくれたので,原因・理由,ありがたかったです
髪を更にショートにしたいけど、,逆接,お願いしたいと思います
パーマ、カラーの色、対しても細かく自分の希望を聞いてくださるので、,原因・理由,とても安心して施術を受けることができます
いつもなんとなくのイメージでほぼノープランですが、,逆接,ありがとうございます
今回も内巻き・外はね両方できるスタイルにしていただいたので、,原因・理由,気分によって楽しみたいと思います
カラーを、前回の施術の時にはカラーとパーマをしていただきましたが,逆接,今回はどちらもリピ確です
とってもお気に入りです縮毛しないとダメかなと思ってたけど、,逆接,最高ありがとうございました♪
カット後、毎回セットの仕方を教えてくださるので、,原因・理由,ヘアアレンジができております♪遠方に引っ越してしまいましたが、
ヘアアレンジができております♪遠方に引っ越してしまいましたが、,逆接,また、これからも利用させていただきます
最後にはなるけど,逆接,ありがとうございます今年で最後にまた行きたいと思いますまた
カラーは会社に..と困る頼み方をしてしまいましたが、,逆接,しっかり可愛いくしていただきました勧めてもらったカラー剤は不快感無しに染めれました
数年ぶりにショートにしましたが,逆接,セットもドライヤーだけで綺麗にまとまります
初めての来店でしたが、,逆接,お願いしたいですありがとうございます
人たちばかり、可愛い人たちばかりで緊張しましたが,逆接,初のパーマが自分じゃないと思えるぐらい
緊張しましたが,逆接,ありがとうございました約10年ぶりの前髪、とても気に入っています居心地が良かったですありがとうございました
次は明るくしようと思ってるので,原因・理由,またよろしくお願いします
初めてのブリーチで緊張していましたが、,逆接,とてもきれいに染めていただきました
細かくヒアリングもしていただいたので,原因・理由,イメージ通りの、髪型にしていただきました
