原因,関係,結果
お店に着いたにもかかわらず、,逆接,すごく素敵な接客して下さいました……
思いをしての今回だったので,原因・理由,のが心残りでした、私のせいなのですが
のが心残りでした、私のせいなのですが,逆接,本当に感動しました……
初めての前頭ブリーチだったので,原因・理由,結構緊張しましたが、
結構緊張しましたが、,逆接,綺麗に仕上がっていて嬉しかったです
悩みましたが,逆接,セットしやすくなりましたありがとうございました
美容室を探していましたが、,逆接,なかなか行き続けようと思える
カラーに関しては相談しながらいくつか選択肢を提案していただけたので、,原因・理由,すごく綺麗な髪色にしていただいたので、
すごく綺麗な髪色にしていただいたので、,原因・理由,色々な髪色を試してみたいなと思います
オイルもドライヤーの前に使っていいものだったので,原因・理由,ありがとうございました
いつもお世話になってますカットもカラーもヘッドスパも半分お任せしちゃう事もありますが、,逆接,行きます
ジメジメしてたので、,原因・理由,行きます
気分がリフレッシュできるので,原因・理由,いつも楽しみにしてます
今日も髪のメンテナンスありがとうございます湿度に耐えられるように少し短くして頂いたので,原因・理由,秋になるまでは乗り切りたいです
大まかな仕上がり希望しか決まっていなかったのですが、,逆接,カラーはとても安心できました
色を一緒に決めてくださったので,原因・理由,カラーはとても安心できました
メリットしかないので,原因・理由,ヘッドスパは今後も継続したいです
はじめて行ってみたのですが、,逆接,接客も丁寧で良かったと思いました
ちょっと贅沢に対応いただけるので,原因・理由,遅めの予約時間はあまりなかったのですが、
遅めの予約時間はあまりなかったのですが、,逆接,のは遠方の私にとって素敵な発見ですまた2ヶ月後にお願いします♪
急な予約にも関わらず,逆接,丁寧に対応してくださいました
初めてのカラーでわからないことが多かったのですが、,逆接,嬉しかったです次のカラーもお願いしたいです
私のオーダーに寄り添いつつも,逆接,適切なアドバイスもあり、
2回目の来店でしたが、,逆接,気遣いが嬉しかったです
我慢できなくなったら矯正で伺いますので,原因・理由,前髪、よろしくお願いします
美容室を転々としていましたが、,逆接,こちらに落ち着きました
曖昧なイメージのまま行ってばかりですが、,逆接,感謝しています
何度かお世話になりましたので、,原因・理由,ことを2つほど失礼いたします
東京に住んでいた頃の美容室でもSYSTEMの取り扱いがございましたが、,逆接,美容室よりも各グレードで1000円ほど高いです
こちら以外にも複数の店舗を展開されているようなので,原因・理由,改善は難しいかと思いますが、
改善は難しいかと思いますが、,逆接,方がより多くの方に体験してもらえるかと思います
声のトーンは気になりませんが、,逆接,感じました
初めて利用したのですが、,逆接,スタッフさんにも利用したいと思います
個々の値段は見てないけど,逆接,縮毛とトリートメントで伺います
美容室のホームケアでは美容師さんとの事なので,原因・理由,縮毛とトリートメントで伺います
トリートメントは色んなお店に行ってやりましたが,逆接,一番合ってる気がします
40代ではありますが,逆接,またトリートメントしに伺いたいと思います
いくつかの美容室で施術してもらいましたが、,逆接,とって仕上がりでした
髪型も髪色も口答のみが多く困らせていますが,逆接,前までは技術はあるのでしょうけど
前までは技術はあるのでしょうけど,逆接,希望通りにならずでしたが
希望通りにならずでしたが,逆接,良い美容師さんはいるんだぁと思いましたそして
乾かすだけでまとまるので,原因・理由,久しぶりに短くしてとても気に入りましたしばらくこのくらいの長さにしようと思いました
来店しましたが、,逆接,「暑くないですか?」と気にかけてくださったりと、
2回目の来店でしたが、,逆接,メニューを提案していただきました
カットもお任せしましたが、,逆接,可愛く切っていただけて満足です
髪色がめっちゃ好きです外国人なので,原因・理由,日本語はあまり上手ではないので、
日本語はあまり上手ではないので、,原因・理由,とても緊張しました
いつもおまかせでお願いしているのですが、,逆接,安心して通わせてもらってます
それでも毎回、細かい所まで確認してもらえるので、,原因・理由,安心して通わせてもらってます
メニュー選択を間違えてしまったのに、,逆接,今回は変更して頂きありがとうございました
初めてヘッドスパをしたのですが、,逆接,気持ち良すぎて爆睡してしまいました
恥ずかしいですが、,逆接,リラックスできてる証拠ですよね
異動先はじめての施術に緊張しましたが、,逆接,お勧めです
安心して相談できるので,原因・理由,お勧めです
2件の美容室では、なかなか思った通りの仕上がりにしてもらえなかったのですが、,逆接,感謝でしたでも、何よりこちらはいろいろな気遣いを感じられました
聞かれたので,原因・理由,伝えるとどういうこと?笑のような感じで言われました
にえ?笑と言われたので,原因・理由,切りましたと
?普通のハサミですか?笑のような感じで全て覚えてませんが,逆接,とにかく話し方が不快でした
ムカついたので,原因・理由,友達とかも切ってる人いると思いますよといったら
美容師さんはいなかったので,原因・理由,接客態度見直すべきだと思います
自分の理念なんですけど,逆接,とかいって、顔周りもいってましたけど、
とかいって、顔周りもいってましたけど、,逆接,他の美容院で直してもらおうと思います
後毛も長さ違うので、,原因・理由,他の美容院で直してもらおうと思います
縮毛矯正に関しては満足はしてますが、,逆接,カットは切られる前に
そんなに愛想良くはないですが、,逆接,良かったので良いかなと思います
とても良かったのですが、,逆接,どんどん理想と離れた髪型になってしまっていました
先日は有難うございました初めて伺うサロンでしたが、,逆接,サロンだと思いました
デザインやカラーを丁寧に説明・提案してくれるので,原因・理由,安心してお任せできます家族にも紹介しました
もちろん、仕上がりも満足しているので、,原因・理由,安心してお任せできます家族にも紹介しました
伝えましたが、,逆接,良かったです
実習が近いので、,原因・理由,中々美容室が定まらなかったのですが、
後はお任せにしましたが、,逆接,実際にやってみようと思います
自然な仕上がりで大満足です自分でスタイリング出来るように巻き方をレクチャーしてもらったので、,原因・理由,実際にやってみようと思います
中々美容室が定まらなかったのですが、,逆接,これからもお世話になりたいです
アシスタントも親切・丁寧な方だったので,原因・理由,とても好印象でしたありがとうございます
不安と緊張の気持ちで行きましたが、,逆接,雰囲気でとても良かったです
カラー剤などが染みてないかどうかの確認も何度もしていただいたので、,原因・理由,雰囲気でとても良かったです
髪の毛が痛むと思っていたのですが、,逆接,ただ、施術中ほかの美容師さんとお客さんが私の好きなアニメの話をしていて、
部分の話だったので、,原因・理由,ショックでした
美容師さんが聞いていたので,原因・理由,お客さんは答えたのかもしれませんが、
お客さんは答えたのかもしれませんが、,逆接,お話してほしかったです
数日経ちましたが,逆接,セットのしやすさなど非常に満足しています
カラーも少し曖昧なイメージを伝えてしまいましたが,逆接,セットしやすいブローのコツなど教えてください
考えてましたが,逆接,やめた方がいいのではと
のが難しいから,原因・理由,やめた方がいいのではと
また行きたいと思うので,原因・理由,その時はよろしくお願いします
相談ばかりしてしまいましたが,逆接,きちんとカウンセリングして下さったおかげでとても理想通りで綺麗に仕上げて頂きました
初めてお願いしましたが、,逆接,カウンセリング含め安心してお願いする事ができました
インスタ拝見しましたが、,逆接,無事お子さんも生まれた様で良かったですね
伸ばしていた髪をばっさり切ってもらったのですが,逆接,良かったなと思いました
初めての来店でしたアバウトな注文にも関わらず,逆接,しっかりと聞いてくれて、
疲れたりすることもあるのですが、,逆接,のもとても良かったです
初めて来店したのですが、,逆接,とても話しやすくてお気に入りですありがとうございました
初めてでしたが,逆接,次はよろしくお願いします
初めての来店でしたが、,逆接,仕上がりが利用させていただきたいと思い
本当に良かったです今までいろんな美容室を転々としていたのですが、,逆接,こんな感動したのはじめてです>_<またよろしくお願いいたします
伺ってしまいましたが,逆接,お店の心づかいに感謝です
ざっくり乾かすだけでスタイリングが出来るので,原因・理由,ショートの間は通うのをやめられそうにありません
良かったのですが、,逆接,所ございませんか?とか苦しくないですか?とか一言もなく終始無言でした
様子が見えたので、,原因・理由,何となく残念な気がしました
色々と相談に乗って頂けるので,原因・理由,いつも丁寧に仕上げて頂いてますありがたいですまた次回もよろしくお願い致します
少し難しいお願いだったの思うのですが、,逆接,親身になって考えてくださりとても嬉しかったです
施術中に15分くらい待ち時間がありましたが、,逆接,それを差し引いても良かったです
半年振りの再来店で髪の毛もかなり傷んでたのですが、,逆接,春を迎えられそうですいつもありがとうございます
カラーは、全体的な明るさをなくしてもらえたので,原因・理由,とても満足でした
長さを変えませんでしたが、,逆接,ボリュームを抑えてもらえ、
困ることがないので,原因・理由,今回は助かっています
2ヶ月経ってましたが,逆接,よく少し重くなってきたかなと
感じていたくらいの持ちの良さだったのですが、,逆接,やっぱり整えていただくともっと扱いやすくて満足しています
気になっていたのですが、,逆接,年齢的に場違いだったらどうしようと思っていました
状態で行ったんですが、,逆接,ありがたかったです
初めての来店でしたが,逆接,本当に感謝しています
遅くなってしまいましたが,逆接,この度はどうもありがとうございました
以前とても満足したので,原因・理由,ありがとうございましたまた宜しくお願いします
少し不安な気持ちがありましたが、,逆接,大変満足しています
ことを躊躇っていたのですが、,逆接,迅速に対応してくださってとても嬉しかったです
のもレイヤーを入れたのも初めてでドキドキしてましたが、,逆接,大満足ですまた行きたいと思います
ちょっとまだ見慣れませんが、,逆接,上げも下ろしもどっちも楽しみたいと思います
セルフセットがなかなか苦手なので、,原因・理由,次回は嬉しいです
初めてのカラーでとても楽しみにしていましたが、,逆接,とても残念でした
染め直しもして頂きましたが、,逆接,真逆と
初カラーで少し緊張しましたが、,逆接,るんるんです笑ありがとうございました旅行楽しんできます
いつもカラーはおまかせですが、,逆接,今回も素敵なカラーにしていただきました
全部お任せして切ってもらいましたが、,逆接,すごく満足しました
初めてのカラーで楽しみにしていたのですが、,逆接,びっくりしました
初めて伺ったのですが、,逆接,落ち着いた場所でした
初めて伺いましたが、,逆接,出来そうですまたよろしくお願いしたいです
仕上がりもものでした帰り際に次回のメニューについてもオススメしてもらえたので、,原因・理由,出来そうですまたよろしくお願いしたいです
特別な式前だったので、,原因・理由,あれこれ相談に乗ってもらいました
明るめのヘアカラーで少し緊張していましたが、,逆接,今のヘアカラーがとても気に入っています
いつも丁寧に施術して頂いております妊娠中でおなかが大きくなってきたため、,原因・理由,出産前にもう一度お願い出来たら、と
カラー剤の配合などがあると思うので,原因・理由,指名した意味はあるとは思っていますが、
指名した意味はあるとは思っていますが、,逆接,少しもやっとしてしまいました
悩んでましたが,逆接,色になりました
ありがとうございましたお手頃な料金なのに,逆接,シャンプーとトリートメントも丁寧にしていただき
初めてのパーマでしたが、,逆接,パーマの仕組みやセット、ケアの仕方等を教えてくださりました
終わった後は帰ってしまいましたが、,逆接,明確に、指定することが苦手ですが、
明確に、指定することが苦手ですが、,逆接,次も利用させていただきたいなと思います
探りでやっていますが、,逆接,洗い方のコツとかあったりしますか?
ありがとうございますトリートメントも3週間くらい経ちましたが,逆接,サラサラのままでやって良かったと思える
系列の店舗でしたが,逆接,新しくチャレンジしたりすることができました
初めて行くサロンさんなので,原因・理由,大変緊張しましたが
大変緊張しましたが,逆接,カットもカラーもトリートメントも満足です
ドキドキしていましたが、,逆接,想像以上に素敵な仕上がりでした夫にも最近で1番良いねと
髪伸ばしたいので,原因・理由,カットは少しだけでしたが、
カットは少しだけでしたが、,逆接,仕上がりも良かったです
初めてサイドバングを作ったので,原因・理由,上手くいくか不安でしたが
初めて行きましたが,逆接,とても良かったです
急遽カラーもお願いしましたが,逆接,気に入りました快く引き受けてもらい嬉しかったですまた次回もよろしくお願いします
金曜日の遅い時間で申し訳なく思いましたが,逆接,最後まで丁寧に対応してくださりました
店員さんはその日は2名しかいませんでしたが、,逆接,方でお店の雰囲気も良かったです
今回はカラーと整える程度のカットでしたが,逆接,どちらもお願いした通りで大満足ですトリートメントもよかったですし、
特に拘りがないので,原因・理由,ざっくりとした説明をしてしまいましたが、
ざっくりとした説明をしてしまいましたが、,逆接,カラーやカット共に満足しています
予算の関係でトリートメントはお断りしてしまいましたが、,逆接,今回は検討してみたいと思います
前髪に悩んでいたのですが、,逆接,ドライヤーの乾かし方も教えていただきました
遅い時間にも関わらず,逆接,丁寧に対応頂きました
初めての利用でしたが,逆接,安心してお任せできました
価格もリーズナブルなので,原因・理由,これからも通いたいです
お気に入りのサロンになかなか出会えなかったので、,原因・理由,行けて本当によかったです少し痛かったです
のが苦手なので,原因・理由,お任せにしましたが、
お任せにしましたが、,逆接,扱いやすい髪型を提案していただきました
色々相談させていただきたいので、,原因・理由,また、次回もよろしくお願いします
カラーとカットを提供してくださるので、,原因・理由,安心してお任せすることができました
トリートメントもしてもらいましたが、,逆接,終わってからずっと髪がツヤツヤです
数日経ちましたが,逆接,いい感じになりました
自分では決めきれないことが多いので,原因・理由,満足していますまたぜひよろしくお願いいたします
今回新規で伺いましたが、,逆接,美容師さんもアシスタントさんも過ごせました
カラーはお願いしましたが,逆接,かなり暗くなりました
言われたので,原因・理由,1週間以上待ってみましたが
1週間以上待ってみましたが,逆接,ほとんど変わりません
カウンセリングの際に明るくできないとは言いましたが,逆接,残念です
暗くはしたくなかったので,原因・理由,残念です
元々かなり明るい髪色だったため、,原因・理由,服も合わなくなりました
カラー、カット、トリートメントのメニューを本当はカラーも暗くしてもらおうかと思いましたが,逆接,とても感謝しています
いった悩みに対しても解消できるほどの対応でしたミストとオイルも購入させていただいたので,原因・理由,アドバイスいただいた通り使用していきたいと思います
段を入れるようにうまくカットしていただいたので、,原因・理由,サイドのすそから緩やかに後ろへ流れるようになりました
行きましたが、,逆接,髪型についても色についてもいろいろご提案いただき仕上がりも満足です
ほとんどお任せでしたが,逆接,嬉しかったですお店の内装も可愛かったです
いうイメージがあまりないまま予約させて頂いたのですが、,逆接,癒されました♪今後もよろしくお願い致します
仕上がりいつも良い感じにして下さるので,原因・理由,癒されました♪今後もよろしくお願い致します
いつもカラーは「おまかせ」ですが、,逆接,嬉しいです
可愛い色合いにしてくださるので,原因・理由,嬉しいです
おうちでのセットの仕方も分かりやすく教えてくれるので,原因・理由,助かります
苦しくないかなど丁寧に確認してくれるので,原因・理由,安心しておまかせ出来ましたまたよろしくお願いします
ありがとうございました今まで色んな美容室でレイヤーカットお願いしていますが,逆接,担当スタイリストさんがます;
お上手でした♪あと前髪縮毛していただいたのですが、,逆接,一番中側が縮毛されてない
普段カラー剤が染みて痛くなりやすいですが、,逆接,快適に過ごせました
カラー前に保護するためのスプレーをかけてもらえたので,原因・理由,快適に過ごせました
毛先がスカスカだったので,原因・理由,レイヤーを入れて赤っぽいブラウンに染めて貰いました
ロング命なので,原因・理由,ほんとは切りたくなかったのですが
ほんとは切りたくなかったのですが,逆接,切れ毛が凄かったため予約させていただきました
似合わないと分かっていたので,原因・理由,)期待していなかったのですが、
)期待していなかったのですが、,逆接,ここのお店はその時はよろしくお願いします
色にするから,原因・理由,似合うか不安で迷っていた
新しい自分を見つけれたので,原因・理由,とても感謝してるし
なって思います色んな美容室を転々としているのですが、,逆接,ここのお店はその時はよろしくお願いします
話しやすくお店の雰囲気が良いので,原因・理由,ここのお店はその時はよろしくお願いします
2度目の利用でしたが、,逆接,仕上がりで大満足です
またお邪魔させていただきますので,原因・理由,宜しくお願いいたします
初めてで緊張していましたが、,逆接,髪綺麗ですねと
トリートメントも髪を伸ばしているので、,原因・理由,あまり大きくは切らなかったのですが、
あまり大きくは切らなかったのですが、,逆接,最後にヘアセットの仕方など丁寧に教えてくれました
カットの後にかなり細かい髪の毛が出てしまったので、,原因・理由,洗い流して頂きたかったかなと
いうのが正直なところですが、,逆接,ただ、全体的に大満足です
急なメニュー変更にもかかわらず、,逆接,楽しかったですまたお願いします
初来店でしたが、,逆接,サラサラな髪に生まれ変わりました
元々インナーのみブリーチしていましたが、,逆接,色味も綺麗で満足です
癖毛をうまく生かしてくださったので,原因・理由,手入れがしやすいです
予約させていただくので,原因・理由,機会があるときは、またよろしくお願いしますね
汲み取って頂き対応頂けるので、,原因・理由,助かりますし
毎回スムーズに施術をして頂けるので,原因・理由,また、非常に助かります
関しても詳しく教えてもらえたので,原因・理由,非常に満足しています
初回でとてもよかったので,原因・理由,のは嬉しいなと
行ったのですが、,逆接,前髪の乾かし方も早速やってみるといい
色々と要望はふんわりとしか伝えられなかったんですが、,逆接,ありがとうございました
ほうがいいので,原因・理由,アシスタントの方も笑また、利用させていただきますありがとうございます
いつもの髪型に飽きてきたので、,原因・理由,髪型の引き出しをたくさん持っている方なので
髪型の引き出しをたくさん持っている方なので,原因・理由,安心して任せられます
はじめて訪れたサロンで少し緊張していましたが、,逆接,担当してくださったスタイリストさんやアシスタントさんをはじめ、みなさん優しく丁寧な方たちばかりでした
初めて利用させて頂きましたが、,逆接,カットからセットまで丁寧な仕上がりで大満足でしたありがとうございました
カットのみお願いしたのですが、,逆接,短いのがあまり似合わないと思っていた
頂いたのですが,逆接,ボサボサの髪がとってもサラサラになりました
美容室苦手なんですけど,逆接,満足です今回はありがとうございました
私は話していたのですが、,逆接,娘は伸ばしたいと思って居るので
娘は伸ばしたいと思って居るので,原因・理由,長さを決めてくれました
毎回サロンを出た直後親子で髪型写真を撮るのですが,逆接,毎回笑顔写真になってます
シャンプーが別料金なので,原因・理由,少しでも安くしたい時にはとても助かります
のが断りにくく帰る時には高くなってしまうが、,逆接,気軽にリピート出来る
ここのサロンは一切無いので,原因・理由,気軽にリピート出来る
ここのケアがこう大変だけど,逆接,大丈夫?と性格を含めアドバイスしてくれます
